{
  "id": "0069d09b-890a-4d1a-8922-d3b0fc8342b1",
  "name": "test_subproject_3",
  "fieldParcelIds": [
    "1111111111"
  ],
  "created": "1971-01-01T00:00:00+00:00",
  "compositionId": "aecea423-a08a-4a33-8a11-18dfb13f171c",
  "modified": [
    {
      "modificationType": "PROJECT_UPDATE",
      "datetime": "1971-01-02T00:00:00+00:00"
    },
    {
      "modificationType": "WEATHER_UPDATE",
      "datetime": "1971-01-03T00:00:00+00:00"
    }
  ]
}
